> sudo tcpdump port 8090 -n
Password:
tcpdump: data link type PKTAP
tcpdump: verbose output suppressed, use -v or -vv for full protocol decode
listening on pktap, link-type PKTAP (Apple DLT_PKTAP), capture size 262144 bytes


02:05:29.008012 IP 192.168.3.3.60950 > 120.77.37.121.8090: Flags [S], seq 2087772726, win 65535, options [mss 1460,nop,wscale 6,nop,nop,TS val 293518990 ecr 0,sackOK,eol], length 0
02:05:29.033683 IP 120.77.37.121.8090 > 192.168.3.3.60950: Flags [S.], seq 2547246498, ack 2087772727, win 28960, options [mss 1380,sackOK,TS val 2777925513 ecr 293518990,nop,wscale 7], length 0
02:05:29.033737 IP 192.168.3.3.60950 > 120.77.37.121.8090: Flags [.], ack 1, win 2052, options [nop,nop,TS val 293519015 ecr 2777925513], length 0
02:05:29.035099 IP 192.168.3.3.60950 > 120.77.37.121.8090: Flags [.], seq 1:1369, ack 1, win 2052, options [nop,nop,TS val 293519016 ecr 2777925513], length 1368
02:05:29.035108 IP 192.168.3.3.60950 > 120.77.37.121.8090: Flags [.], seq 1369:2737, ack 1, win 2052, options [nop,nop,TS val 293519016 ecr 2777925513], length 1368
02:05:29.035110 IP 192.168.3.3.60950 > 120.77.37.121.8090: Flags [.], seq 2737:4105, ack 1, win 2052, options [nop,nop,TS val 293519016 ecr 2777925513], length 1368
02:05:29.066975 IP 120.77.37.121.8090 > 192.168.3.3.60950: Flags [.], ack 1369, win 248, options [nop,nop,TS val 2777925547 ecr 293519016], length 0
02:05:29.067087 IP 192.168.3.3.60950 > 120.77.37.121.8090: Flags [.], seq 4105:5473, ack 1, win 2052, options [nop,nop,TS val 293519047 ecr 2777925547], length 1368
02:05:29.067102 IP 192.168.3.3.60950 > 120.77.37.121.8090: Flags [.], seq 5473:6841, ack 1, win 2052, options [nop,nop,TS val 293519047 ecr 2777925547], length 1368
02:05:29.068395 IP 120.77.37.121.8090 > 192.168.3.3.60950: Flags [.], ack 1369, win 269, options [nop,nop,TS val 2777925549 ecr 293519016,nop,nop,sack 1 {2737:4105}], length 0
02:05:29.068400 IP 120.77.37.121.8090 > 192.168.3.3.60950: Flags [.], ack 4105, win 291, options [nop,nop,TS val 2777925549 ecr 293519016], length 0
02:05:29.068425 IP 192.168.3.3.60950 > 120.77.37.121.8090: Flags [.], seq 6841:8209, ack 1, win 2052, options [nop,nop,TS val 293519048 ecr 2777925549], length 1368
02:05:29.068443 IP 192.168.3.3.60950 > 120.77.37.121.8090: Flags [.], seq 8209:9577, ack 1, win 2052, options [nop,nop,TS val 293519048 ecr 2777925549], length 1368
02:05:29.068445 IP 192.168.3.3.60950 > 120.77.37.121.8090: Flags [.], seq 9577:10945, ack 1, win 2052, options [nop,nop,TS val 293519048 ecr 2777925549], length 1368
02:05:29.068446 IP 192.168.3.3.60950 > 120.77.37.121.8090: Flags [.], seq 10945:12313, ack 1, win 2052, options [nop,nop,TS val 293519048 ecr 2777925549], length 1368
02:05:29.089996 IP 120.77.37.121.8090 > 192.168.3.3.60950: Flags [.], ack 5473, win 312, options [nop,nop,TS val 2777925571 ecr 293519047], length 0
02:05:29.090002 IP 120.77.37.121.8090 > 192.168.3.3.60950: Flags [.], ack 6841, win 334, options [nop,nop,TS val 2777925572 ecr 293519047], length 0
02:05:29.090033 IP 192.168.3.3.60950 > 120.77.37.121.8090: Flags [.], seq 12313:13681, ack 1, win 2052, options [nop,nop,TS val 293519069 ecr 2777925571], length 1368
02:05:29.090037 IP 192.168.3.3.60950 > 120.77.37.121.8090: Flags [.], seq 13681:15049, ack 1, win 2052, options [nop,nop,TS val 293519069 ecr 2777925571], length 1368
02:05:29.090046 IP 192.168.3.3.60950 > 120.77.37.121.8090: Flags [.], seq 15049:16417, ack 1, win 2052, options [nop,nop,TS val 293519069 ecr 2777925572], length 1368
02:05:29.090047 IP 192.168.3.3.60950 > 120.77.37.121.8090: Flags [.], seq 16417:17785, ack 1, win 2052, options [nop,nop,TS val 293519069 ecr 2777925572], length 1368
02:05:29.097255 IP 120.77.37.121.8090 > 192.168.3.3.60950: Flags [.], ack 8209, win 355, options [nop,nop,TS val 2777925578 ecr 293519048], length 0
02:05:29.097326 IP 192.168.3.3.60950 > 120.77.37.121.8090: Flags [.], seq 17785:19153, ack 1, win 2052, options [nop,nop,TS val 293519076 ecr 2777925578], length 1368
02:05:29.097338 IP 192.168.3.3.60950 > 120.77.37.121.8090: Flags [.], seq 19153:20521, ack 1, win 2052, options [nop,nop,TS val 293519076 ecr 2777925578], length 1368
02:05:29.098546 IP 120.77.37.121.8090 > 192.168.3.3.60950: Flags [.], ack 9577, win 376, options [nop,nop,TS val 2777925579 ecr 293519048], length 0
02:05:29.098554 IP 120.77.37.121.8090 > 192.168.3.3.60950: Flags [.], ack 10945, win 398, options [nop,nop,TS val 2777925579 ecr 293519048], length 0
02:05:29.098555 IP 120.77.37.121.8090 > 192.168.3.3.60950: Flags [.], ack 12313, win 419, options [nop,nop,TS val 2777925580 ecr 293519048], length 0
02:05:29.098624 IP 192.168.3.3.60950 > 120.77.37.121.8090: Flags [.], seq 20521:21889, ack 1, win 2052, options [nop,nop,TS val 293519077 ecr 2777925579], length 1368
02:05:29.098632 IP 192.168.3.3.60950 > 120.77.37.121.8090: Flags [.], seq 21889:23257, ack 1, win 2052, options [nop,nop,TS val 293519077 ecr 2777925579], length 1368
02:05:29.098645 IP 192.168.3.3.60950 > 120.77.37.121.8090: Flags [.], seq 23257:24625, ack 1, win 2052, options [nop,nop,TS val 293519077 ecr 2777925579], length 1368
02:05:29.098647 IP 192.168.3.3.60950 > 120.77.37.121.8090: Flags [.], seq 24625:25993, ack 1, win 2052, options [nop,nop,TS val 293519077 ecr 2777925579], length 1368
02:05:29.098661 IP 192.168.3.3.60950 > 120.77.37.121.8090: Flags [.], seq 25993:27361, ack 1, win 2052, options [nop,nop,TS val 293519077 ecr 2777925580], length 1368
02:05:29.098667 IP 192.168.3.3.60950 > 120.77.37.121.8090: Flags [.], seq 27361:28729, ack 1, win 2052, options [nop,nop,TS val 293519077 ecr 2777925580], length 1368
02:05:29.113258 IP 120.77.37.121.8090 > 192.168.3.3.60950: Flags [.], ack 13681, win 440, options [nop,nop,TS val 2777925594 ecr 293519069], length 0
02:05:29.113266 IP 120.77.37.121.8090 > 192.168.3.3.60950: Flags [.], ack 15049, win 462, options [nop,nop,TS val 2777925595 ecr 293519069], length 0
02:05:29.113307 IP 192.168.3.3.60950 > 120.77.37.121.8090: Flags [.], seq 28729:30097, ack 1, win 2052, options [nop,nop,TS val 293519091 ecr 2777925594], length 1368
02:05:29.113315 IP 192.168.3.3.60950 > 120.77.37.121.8090: Flags [.], seq 30097:31465, ack 1, win 2052, options [nop,nop,TS val 293519091 ecr 2777925594], length 1368
02:05:29.113334 IP 192.168.3.3.60950 > 120.77.37.121.8090: Flags [.], seq 31465:32833, ack 1, win 2052, options [nop,nop,TS val 293519091 ecr 2777925595], length 1368
02:05:29.113338 IP 192.168.3.3.60950 > 120.77.37.121.8090: Flags [.], seq 32833:34201, ack 1, win 2052, options [nop,nop,TS val 293519091 ecr 2777925595], length 1368
02:05:29.122049 IP 120.77.37.121.8090 > 192.168.3.3.60950: Flags [.], ack 16417, win 483, options [nop,nop,TS val 2777925603 ecr 293519069], length 0
02:05:29.122057 IP 120.77.37.121.8090 > 192.168.3.3.60950: Flags [.], ack 17785, win 505, options [nop,nop,TS val 2777925603 ecr 293519069], length 0
02:05:29.122097 IP 192.168.3.3.60950 > 120.77.37.121.8090: Flags [.], seq 34201:35569, ack 1, win 2052, options [nop,nop,TS val 293519099 ecr 2777925603], length 1368
02:05:29.122105 IP 192.168.3.3.60950 > 120.77.37.121.8090: Flags [.], seq 35569:36937, ack 1, win 2052, options [nop,nop,TS val 293519099 ecr 2777925603], length 1368
02:05:29.122122 IP 192.168.3.3.60950 > 120.77.37.121.8090: Flags [.], seq 36937:38305, ack 1, win 2052, options [nop,nop,TS val 293519099 ecr 2777925603], length 1368
02:05:29.122125 IP 192.168.3.3.60950 > 120.77.37.121.8090: Flags [.], seq 38305:39673, ack 1, win 2052, options [nop,nop,TS val 293519099 ecr 2777925603], length 1368
02:05:29.123558 IP 120.77.37.121.8090 > 192.168.3.3.60950: Flags [.], ack 20521, win 547, options [nop,nop,TS val 2777925604 ecr 293519076], length 0
02:05:29.123609 IP 192.168.3.3.60950 > 120.77.37.121.8090: Flags [.], seq 39673:41041, ack 1, win 2052, options [nop,nop,TS val 293519100 ecr 2777925604], length 1368
02:05:29.123616 IP 192.168.3.3.60950 > 120.77.37.121.8090: Flags [.], seq 41041:42409, ack 1, win 2052, options [nop,nop,TS val 293519100 ecr 2777925604], length 1368
02:05:29.123618 IP 192.168.3.3.60950 > 120.77.37.121.8090: Flags [.], seq 42409:43777, ack 1, win 2052, options [nop,nop,TS val 293519100 ecr 2777925604], length 1368
02:05:29.123620 IP 192.168.3.3.60950 > 120.77.37.121.8090: Flags [.], seq 43777:45145, ack 1, win 2052, options [nop,nop,TS val 293519100 ecr 2777925604], length 1368
02:05:29.130320 IP 120.77.37.121.8090 > 192.168.3.3.60950: Flags [.], ack 21889, win 569, options [nop,nop,TS val 2777925611 ecr 293519077], length 0
02:05:29.130328 IP 120.77.37.121.8090 > 192.168.3.3.60950: Flags [.], ack 23257, win 590, options [nop,nop,TS val 2777925612 ecr 293519077], length 0
02:05:29.130370 IP 192.168.3.3.60950 > 120.77.37.121.8090: Flags [.], seq 45145:46513, ack 1, win 2052, options [nop,nop,TS val 293519106 ecr 2777925611], length 1368
02:05:29.130377 IP 192.168.3.3.60950 > 120.77.37.121.8090: Flags [.], seq 46513:47881, ack 1, win 2052, options [nop,nop,TS val 293519106 ecr 2777925611], length 1368
02:05:29.130395 IP 192.168.3.3.60950 > 120.77.37.121.8090: Flags [.], seq 47881:49249, ack 1, win 2052, options [nop,nop,TS val 293519106 ecr 2777925612], length 1368
02:05:29.130398 IP 192.168.3.3.60950 > 120.77.37.121.8090: Flags [.], seq 49249:50617, ack 1, win 2052, options [nop,nop,TS val 293519106 ecr 2777925612], length 1368
02:05:29.131833 IP 120.77.37.121.8090 > 192.168.3.3.60950: Flags [.], ack 24625, win 611, options [nop,nop,TS val 2777925612 ecr 293519077], length 0
02:05:29.131880 IP 192.168.3.3.60950 > 120.77.37.121.8090: Flags [.], seq 50617:51985, ack 1, win 2052, options [nop,nop,TS val 293519107 ecr 2777925612], length 1368
02:05:29.131888 IP 192.168.3.3.60950 > 120.77.37.121.8090: Flags [.], seq 51985:53353, ack 1, win 2052, options [nop,nop,TS val 293519107 ecr 2777925612], length 1368
02:05:29.133673 IP 120.77.37.121.8090 > 192.168.3.3.60950: Flags [.], ack 25993, win 633, options [nop,nop,TS val 2777925614 ecr 293519077], length 0
02:05:29.133680 IP 120.77.37.121.8090 > 192.168.3.3.60950: Flags [.], ack 27361, win 654, options [nop,nop,TS val 2777925615 ecr 293519077], length 0
02:05:29.133682 IP 120.77.37.121.8090 > 192.168.3.3.60950: Flags [.], ack 28729, win 676, options [nop,nop,TS val 2777925615 ecr 293519077], length 0
02:05:29.133723 IP 192.168.3.3.60950 > 120.77.37.121.8090: Flags [.], seq 53353:54721, ack 1, win 2052, options [nop,nop,TS val 293519108 ecr 2777925614], length 1368
02:05:29.133730 IP 192.168.3.3.60950 > 120.77.37.121.8090: Flags [.], seq 54721:56089, ack 1, win 2052, options [nop,nop,TS val 293519108 ecr 2777925614], length 1368
02:05:29.133746 IP 192.168.3.3.60950 > 120.77.37.121.8090: Flags [.], seq 56089:57457, ack 1, win 2052, options [nop,nop,TS val 293519108 ecr 2777925615], length 1368
02:05:29.133749 IP 192.168.3.3.60950 > 120.77.37.121.8090: Flags [.], seq 57457:58825, ack 1, win 2052, options [nop,nop,TS val 293519108 ecr 2777925615], length 1368
02:05:29.133766 IP 192.168.3.3.60950 > 120.77.37.121.8090: Flags [.], seq 58825:60193, ack 1, win 2052, options [nop,nop,TS val 293519108 ecr 2777925615], length 1368
02:05:29.133769 IP 192.168.3.3.60950 > 120.77.37.121.8090: Flags [.], seq 60193:61561, ack 1, win 2052, options [nop,nop,TS val 293519108 ecr 2777925615], length 1368
02:05:29.142092 IP 120.77.37.121.8090 > 192.168.3.3.60950: Flags [.], ack 31465, win 718, options [nop,nop,TS val 2777925619 ecr 293519091], length 0
02:05:29.142100 IP 120.77.37.121.8090 > 192.168.3.3.60950: Flags [.], ack 34201, win 761, options [nop,nop,TS val 2777925621 ecr 293519091], length 0
02:05:29.142147 IP 192.168.3.3.60950 > 120.77.37.121.8090: Flags [.], seq 61561:62929, ack 1, win 2052, options [nop,nop,TS val 293519116 ecr 2777925619], length 1368
02:05:29.142154 IP 192.168.3.3.60950 > 120.77.37.121.8090: Flags [.], seq 62929:64297, ack 1, win 2052, options [nop,nop,TS val 293519116 ecr 2777925619], length 1368
02:05:29.142157 IP 192.168.3.3.60950 > 120.77.37.121.8090: Flags [.], seq 64297:65665, ack 1, win 2052, options [nop,nop,TS val 293519116 ecr 2777925619], length 1368
02:05:29.142159 IP 192.168.3.3.60950 > 120.77.37.121.8090: Flags [.], seq 65665:67033, ack 1, win 2052, options [nop,nop,TS val 293519116 ecr 2777925619], length 1368
02:05:29.142188 IP 192.168.3.3.60950 > 120.77.37.121.8090: Flags [.], seq 67033:68401, ack 1, win 2052, options [nop,nop,TS val 293519116 ecr 2777925621], length 1368
02:05:29.142191 IP 192.168.3.3.60950 > 120.77.37.121.8090: Flags [.], seq 68401:69769, ack 1, win 2052, options [nop,nop,TS val 293519116 ecr 2777925621], length 1368
02:05:29.142194 IP 192.168.3.3.60950 > 120.77.37.121.8090: Flags [.], seq 69769:71137, ack 1, win 2052, options [nop,nop,TS val 293519116 ecr 2777925621], length 1368
02:05:29.142196 IP 192.168.3.3.60950 > 120.77.37.121.8090: Flags [.], seq 71137:72505, ack 1, win 2052, options [nop,nop,TS val 293519116 ecr 2777925621], length 1368
02:05:29.146854 IP 120.77.37.121.8090 > 192.168.3.3.60950: Flags [.], ack 35569, win 782, options [nop,nop,TS val 2777925627 ecr 293519099], length 0
02:05:29.146860 IP 120.77.37.121.8090 > 192.168.3.3.60950: Flags [.], ack 36937, win 804, options [nop,nop,TS val 2777925629 ecr 293519099], length 0
02:05:29.146897 IP 192.168.3.3.60950 > 120.77.37.121.8090: Flags [.], seq 72505:73873, ack 1, win 2052, options [nop,nop,TS val 293519120 ecr 2777925627], length 1368
02:05:29.146904 IP 192.168.3.3.60950 > 120.77.37.121.8090: Flags [.], seq 73873:75241, ack 1, win 2052, options [nop,nop,TS val 293519120 ecr 2777925627], length 1368
02:05:29.146917 IP 192.168.3.3.60950 > 120.77.37.121.8090: Flags [.], seq 75241:76609, ack 1, win 2052, options [nop,nop,TS val 293519120 ecr 2777925629], length 1368
02:05:29.146919 IP 192.168.3.3.60950 > 120.77.37.121.8090: Flags [.], seq 76609:77977, ack 1, win 2052, options [nop,nop,TS val 293519120 ecr 2777925629], length 1368
02:05:29.148306 IP 120.77.37.121.8090 > 192.168.3.3.60950: Flags [.], ack 38305, win 825, options [nop,nop,TS val 2777925629 ecr 293519099], length 0
02:05:29.148347 IP 192.168.3.3.60950 > 120.77.37.121.8090: Flags [.], seq 77977:79345, ack 1, win 2052, options [nop,nop,TS val 293519121 ecr 2777925629], length 1368
02:05:29.148353 IP 192.168.3.3.60950 > 120.77.37.121.8090: Flags [.], seq 79345:80713, ack 1, win 2052, options [nop,nop,TS val 293519121 ecr 2777925629], length 1368
02:05:29.149905 IP 120.77.37.121.8090 > 192.168.3.3.60950: Flags [.], ack 39673, win 847, options [nop,nop,TS val 2777925630 ecr 293519099], length 0
02:05:29.149911 IP 120.77.37.121.8090 > 192.168.3.3.60950: Flags [.], ack 42409, win 881, options [nop,nop,TS val 2777925631 ecr 293519100], length 0
02:05:29.149947 IP 192.168.3.3.60950 > 120.77.37.121.8090: Flags [.], seq 80713:82081, ack 1, win 2052, options [nop,nop,TS val 293519122 ecr 2777925630], length 1368
02:05:29.149953 IP 192.168.3.3.60950 > 120.77.37.121.8090: Flags [.], seq 82081:83449, ack 1, win 2052, options [nop,nop,TS val 293519122 ecr 2777925630], length 1368
02:05:29.149972 IP 192.168.3.3.60950 > 120.77.37.121.8090: Flags [.], seq 83449:84817, ack 1, win 2052, options [nop,nop,TS val 293519122 ecr 2777925631], length 1368
02:05:29.149977 IP 192.168.3.3.60950 > 120.77.37.121.8090: Flags [.], seq 84817:86185, ack 1, win 2052, options [nop,nop,TS val 293519122 ecr 2777925631], length 1368
02:05:29.149980 IP 192.168.3.3.60950 > 120.77.37.121.8090: Flags [.], seq 86185:87553, ack 1, win 2052, options [nop,nop,TS val 293519122 ecr 2777925631], length 1368
02:05:29.149982 IP 192.168.3.3.60950 > 120.77.37.121.8090: Flags [.], seq 87553:88921, ack 1, win 2052, options [nop,nop,TS val 293519122 ecr 2777925631], length 1368
02:05:29.152256 IP 120.77.37.121.8090 > 192.168.3.3.60950: Flags [.], ack 45145, win 860, options [nop,nop,TS val 2777925633 ecr 293519100], length 0
02:05:29.152297 IP 192.168.3.3.60950 > 120.77.37.121.8090: Flags [.], seq 88921:90289, ack 1, win 2052, options [nop,nop,TS val 293519124 ecr 2777925633], length 1368
02:05:29.152303 IP 192.168.3.3.60950 > 120.77.37.121.8090: Flags [.], seq 90289:91657, ack 1, win 2052, options [nop,nop,TS val 293519124 ecr 2777925633], length 1368
02:05:29.152305 IP 192.168.3.3.60950 > 120.77.37.121.8090: Flags [.], seq 91657:93025, ack 1, win 2052, options [nop,nop,TS val 293519124 ecr 2777925633], length 1368
02:05:29.152307 IP 192.168.3.3.60950 > 120.77.37.121.8090: Flags [.], seq 93025:94393, ack 1, win 2052, options [nop,nop,TS val 293519124 ecr 2777925633], length 1368
02:05:29.156703 IP 120.77.37.121.8090 > 192.168.3.3.60950: Flags [.], ack 46513, win 850, options [nop,nop,TS val 2777925636 ecr 293519106], length 0
02:05:29.156709 IP 120.77.37.121.8090 > 192.168.3.3.60950: Flags [.], ack 47881, win 840, options [nop,nop,TS val 2777925637 ecr 293519106], length 0
02:05:29.156746 IP 192.168.3.3.60950 > 120.77.37.121.8090: Flags [.], seq 94393:95761, ack 1, win 2052, options [nop,nop,TS val 293519128 ecr 2777925636], length 1368
02:05:29.156752 IP 192.168.3.3.60950 > 120.77.37.121.8090: Flags [.], seq 95761:97129, ack 1, win 2052, options [nop,nop,TS val 293519128 ecr 2777925636], length 1368
02:05:29.156769 IP 192.168.3.3.60950 > 120.77.37.121.8090: Flags [.], seq 97129:98497, ack 1, win 2052, options [nop,nop,TS val 293519128 ecr 2777925637], length 1368
02:05:29.156772 IP 192.168.3.3.60950 > 120.77.37.121.8090: Flags [.], seq 98497:99865, ack 1, win 2052, options [nop,nop,TS val 293519128 ecr 2777925637], length 1368
02:05:29.156774 IP 192.168.3.3.60950 > 120.77.37.121.8090: Flags [P.], seq 99865:100001, ack 1, win 2052, options [nop,nop,TS val 293519128 ecr 2777925637], length 136
02:05:29.157147 IP 120.77.37.121.8090 > 192.168.3.3.60950: Flags [.], ack 50617, win 819, options [nop,nop,TS val 2777925638 ecr 293519106], length 0
02:05:29.158456 IP 120.77.37.121.8090 > 192.168.3.3.60950: Flags [.], ack 51985, win 809, options [nop,nop,TS val 2777925639 ecr 293519107], length 0
02:05:29.158463 IP 120.77.37.121.8090 > 192.168.3.3.60950: Flags [.], ack 53353, win 799, options [nop,nop,TS val 2777925639 ecr 293519107], length 0
02:05:29.163760 IP 120.77.37.121.8090 > 192.168.3.3.60950: Flags [.], ack 54721, win 789, options [nop,nop,TS val 2777925645 ecr 293519108], length 0
02:05:29.163769 IP 120.77.37.121.8090 > 192.168.3.3.60950: Flags [.], ack 56089, win 779, options [nop,nop,TS val 2777925645 ecr 293519108], length 0
02:05:29.182181 IP 192.168.3.3.60950 > 120.77.37.121.8090: Flags [P.], seq 98633:100001, ack 1, win 2052, options [nop,nop,TS val 293519151 ecr 2777925645], length 1368
02:05:29.204413 IP 120.77.37.121.8090 > 192.168.3.3.60950: Flags [.], ack 71137, win 662, options [nop,nop,TS val 2777925685 ecr 293519108], length 0
02:05:29.238618 IP 120.77.37.121.8090 > 192.168.3.3.60950: Flags [.], ack 84817, win 556, options [nop,nop,TS val 2777925718 ecr 293519116], length 0
02:05:29.270001 IP 120.77.37.121.8090 > 192.168.3.3.60950: Flags [.], ack 98497, win 450, options [nop,nop,TS val 2777925750 ecr 293519122], length 0
02:05:29.309789 IP 120.77.37.121.8090 > 192.168.3.3.60950: Flags [.], ack 100001, win 439, options [nop,nop,TS val 2777925791 ecr 293519128,nop,nop,sack 1 {98633:100001}], length 0
02:05:30.073678 IP 192.168.3.3.60950 > 120.77.37.121.8090: Flags [.], seq 100001:101369, ack 1, win 2052, options [nop,nop,TS val 293520040 ecr 2777925791], length 1368
02:05:30.073696 IP 192.168.3.3.60950 > 120.77.37.121.8090: Flags [.], seq 101369:102737, ack 1, win 2052, options [nop,nop,TS val 293520040 ecr 2777925791], length 1368
02:05:30.073704 IP 192.168.3.3.60950 > 120.77.37.121.8090: Flags [.], seq 102737:104105, ack 1, win 2052, options [nop,nop,TS val 293520040 ecr 2777925791], length 1368
02:05:30.073714 IP 192.168.3.3.60950 > 120.77.37.121.8090: Flags [.], seq 104105:105473, ack 1, win 2052, options [nop,nop,TS val 293520040 ecr 2777925791], length 1368
02:05:30.103921 IP 120.77.37.121.8090 > 192.168.3.3.60950: Flags [.], ack 101369, win 429, options [nop,nop,TS val 2777926585 ecr 293520040], length 0
02:05:30.103952 IP 192.168.3.3.60950 > 120.77.37.121.8090: Flags [.], seq 105473:106841, ack 1, win 2052, options [nop,nop,TS val 293520070 ecr 2777926585], length 1368
02:05:30.103956 IP 192.168.3.3.60950 > 120.77.37.121.8090: Flags [.], seq 106841:108209, ack 1, win 2052, options [nop,nop,TS val 293520070 ecr 2777926585], length 1368
02:05:30.145544 IP 120.77.37.121.8090 > 192.168.3.3.60950: Flags [.], ack 108209, win 376, options [nop,nop,TS val 2777926625 ecr 293520040], length 0
02:05:30.145605 IP 192.168.3.3.60950 > 120.77.37.121.8090: Flags [.], seq 108209:109577, ack 1, win 2052, options [nop,nop,TS val 293520111 ecr 2777926625], length 1368
02:05:30.145613 IP 192.168.3.3.60950 > 120.77.37.121.8090: Flags [.], seq 109577:110945, ack 1, win 2052, options [nop,nop,TS val 293520111 ecr 2777926625], length 1368
02:05:30.145615 IP 192.168.3.3.60950 > 120.77.37.121.8090: Flags [.], seq 110945:112313, ack 1, win 2052, options [nop,nop,TS val 293520111 ecr 2777926625], length 1368
02:05:30.145617 IP 192.168.3.3.60950 > 120.77.37.121.8090: Flags [.], seq 112313:113681, ack 1, win 2052, options [nop,nop,TS val 293520111 ecr 2777926625], length 1368
02:05:30.145618 IP 192.168.3.3.60950 > 120.77.37.121.8090: Flags [.], seq 113681:115049, ack 1, win 2052, options [nop,nop,TS val 293520111 ecr 2777926625], length 1368
02:05:30.145620 IP 192.168.3.3.60950 > 120.77.37.121.8090: Flags [.], seq 115049:116417, ack 1, win 2052, options [nop,nop,TS val 293520111 ecr 2777926625], length 1368
02:05:30.145622 IP 192.168.3.3.60950 > 120.77.37.121.8090: Flags [.], seq 116417:117785, ack 1, win 2052, options [nop,nop,TS val 293520111 ecr 2777926625], length 1368
02:05:30.168404 IP 120.77.37.121.8090 > 192.168.3.3.60950: Flags [.], ack 109577, win 911, options [nop,nop,TS val 2777926649 ecr 293520111], length 0
02:05:30.168412 IP 120.77.37.121.8090 > 192.168.3.3.60950: Flags [.], ack 110945, win 920, options [nop,nop,TS val 2777926650 ecr 293520111], length 0
02:05:30.168445 IP 192.168.3.3.60950 > 120.77.37.121.8090: Flags [.], seq 117785:119153, ack 1, win 2052, options [nop,nop,TS val 293520133 ecr 2777926649], length 1368
02:05:30.168456 IP 192.168.3.3.60950 > 120.77.37.121.8090: Flags [.], seq 119153:120521, ack 1, win 2052, options [nop,nop,TS val 293520133 ecr 2777926649], length 1368
02:05:30.168466 IP 192.168.3.3.60950 > 120.77.37.121.8090: Flags [.], seq 120521:121889, ack 1, win 2052, options [nop,nop,TS val 293520133 ecr 2777926650], length 1368
02:05:30.168471 IP 192.168.3.3.60950 > 120.77.37.121.8090: Flags [.], seq 121889:123257, ack 1, win 2052, options [nop,nop,TS val 293520133 ecr 2777926650], length 1368
02:05:30.209845 IP 120.77.37.121.8090 > 192.168.3.3.60950: Flags [.], ack 123257, win 824, options [nop,nop,TS val 2777926691 ecr 293520111], length 0
02:05:30.209901 IP 192.168.3.3.60950 > 120.77.37.121.8090: Flags [.], seq 123257:124625, ack 1, win 2052, options [nop,nop,TS val 293520174 ecr 2777926691], length 1368
02:05:30.209907 IP 192.168.3.3.60950 > 120.77.37.121.8090: Flags [.], seq 124625:125993, ack 1, win 2052, options [nop,nop,TS val 293520174 ecr 2777926691], length 1368
02:05:30.209909 IP 192.168.3.3.60950 > 120.77.37.121.8090: Flags [.], seq 125993:127361, ack 1, win 2052, options [nop,nop,TS val 293520174 ecr 2777926691], length 1368
02:05:30.209910 IP 192.168.3.3.60950 > 120.77.37.121.8090: Flags [.], seq 127361:128729, ack 1, win 2052, options [nop,nop,TS val 293520174 ecr 2777926691], length 1368
02:05:30.209911 IP 192.168.3.3.60950 > 120.77.37.121.8090: Flags [.], seq 128729:130097, ack 1, win 2052, options [nop,nop,TS val 293520174 ecr 2777926691], length 1368
02:05:30.209913 IP 192.168.3.3.60950 > 120.77.37.121.8090: Flags [.], seq 130097:131465, ack 1, win 2052, options [nop,nop,TS val 293520174 ecr 2777926691], length 1368
02:05:30.209914 IP 192.168.3.3.60950 > 120.77.37.121.8090: Flags [.], seq 131465:132833, ack 1, win 2052, options [nop,nop,TS val 293520174 ecr 2777926691], length 1368
02:05:30.209916 IP 192.168.3.3.60950 > 120.77.37.121.8090: Flags [.], seq 132833:134201, ack 1, win 2052, options [nop,nop,TS val 293520174 ecr 2777926691], length 1368
02:05:30.209917 IP 192.168.3.3.60950 > 120.77.37.121.8090: Flags [.], seq 134201:135569, ack 1, win 2052, options [nop,nop,TS val 293520174 ecr 2777926691], length 1368
02:05:30.209919 IP 192.168.3.3.60950 > 120.77.37.121.8090: Flags [.], seq 135569:136937, ack 1, win 2052, options [nop,nop,TS val 293520174 ecr 2777926691], length 1368
02:05:30.209922 IP 192.168.3.3.60950 > 120.77.37.121.8090: Flags [.], seq 136937:138305, ack 1, win 2052, options [nop,nop,TS val 293520174 ecr 2777926691], length 1368
02:05:30.297441 IP 120.77.37.121.8090 > 192.168.3.3.60950: Flags [.], ack 138305, win 707, options [nop,nop,TS val 2777926777 ecr 293520174], length 0
02:05:30.297500 IP 192.168.3.3.60950 > 120.77.37.121.8090: Flags [.], seq 138305:139673, ack 1, win 2052, options [nop,nop,TS val 293520261 ecr 2777926777], length 1368
02:05:30.297507 IP 192.168.3.3.60950 > 120.77.37.121.8090: Flags [.], seq 139673:141041, ack 1, win 2052, options [nop,nop,TS val 293520261 ecr 2777926777], length 1368
02:05:30.297508 IP 192.168.3.3.60950 > 120.77.37.121.8090: Flags [.], seq 141041:142409, ack 1, win 2052, options [nop,nop,TS val 293520261 ecr 2777926777], length 1368
02:05:30.297510 IP 192.168.3.3.60950 > 120.77.37.121.8090: Flags [.], seq 142409:143777, ack 1, win 2052, options [nop,nop,TS val 293520261 ecr 2777926777], length 1368
02:05:30.297511 IP 192.168.3.3.60950 > 120.77.37.121.8090: Flags [.], seq 143777:145145, ack 1, win 2052, options [nop,nop,TS val 293520261 ecr 2777926777], length 1368
02:05:30.297513 IP 192.168.3.3.60950 > 120.77.37.121.8090: Flags [.], seq 145145:146513, ack 1, win 2052, options [nop,nop,TS val 293520261 ecr 2777926777], length 1368
02:05:30.297514 IP 192.168.3.3.60950 > 120.77.37.121.8090: Flags [.], seq 146513:147881, ack 1, win 2052, options [nop,nop,TS val 293520261 ecr 2777926777], length 1368
02:05:30.297516 IP 192.168.3.3.60950 > 120.77.37.121.8090: Flags [.], seq 147881:149249, ack 1, win 2052, options [nop,nop,TS val 293520261 ecr 2777926777], length 1368
02:05:30.297517 IP 192.168.3.3.60950 > 120.77.37.121.8090: Flags [.], seq 149249:150617, ack 1, win 2052, options [nop,nop,TS val 293520261 ecr 2777926777], length 1368
02:05:30.297521 IP 192.168.3.3.60950 > 120.77.37.121.8090: Flags [.], seq 150617:151985, ack 1, win 2052, options [nop,nop,TS val 293520261 ecr 2777926777], length 1368
02:05:30.297523 IP 192.168.3.3.60950 > 120.77.37.121.8090: Flags [.], seq 151985:153353, ack 1, win 2052, options [nop,nop,TS val 293520261 ecr 2777926777], length 1368
02:05:30.297526 IP 192.168.3.3.60950 > 120.77.37.121.8090: Flags [.], seq 153353:154721, ack 1, win 2052, options [nop,nop,TS val 293520261 ecr 2777926777], length 1368
02:05:30.297527 IP 192.168.3.3.60950 > 120.77.37.121.8090: Flags [.], seq 154721:156089, ack 1, win 2052, options [nop,nop,TS val 293520261 ecr 2777926777], length 1368
02:05:30.361109 IP 120.77.37.121.8090 > 192.168.3.3.60950: Flags [.], ack 156089, win 569, options [nop,nop,TS val 2777926842 ecr 293520261], length 0
02:05:30.361172 IP 192.168.3.3.60950 > 120.77.37.121.8090: Flags [.], seq 156089:157457, ack 1, win 2052, options [nop,nop,TS val 293520324 ecr 2777926842], length 1368
02:05:30.361179 IP 192.168.3.3.60950 > 120.77.37.121.8090: Flags [.], seq 157457:158825, ack 1, win 2052, options [nop,nop,TS val 293520324 ecr 2777926842], length 1368
02:05:30.361181 IP 192.168.3.3.60950 > 120.77.37.121.8090: Flags [.], seq 158825:160193, ack 1, win 2052, options [nop,nop,TS val 293520324 ecr 2777926842], length 1368
02:05:30.361183 IP 192.168.3.3.60950 > 120.77.37.121.8090: Flags [.], seq 160193:161561, ack 1, win 2052, options [nop,nop,TS val 293520324 ecr 2777926842], length 1368
02:05:30.361184 IP 192.168.3.3.60950 > 120.77.37.121.8090: Flags [.], seq 161561:162929, ack 1, win 2052, options [nop,nop,TS val 293520324 ecr 2777926842], length 1368
02:05:30.361187 IP 192.168.3.3.60950 > 120.77.37.121.8090: Flags [.], seq 162929:164297, ack 1, win 2052, options [nop,nop,TS val 293520324 ecr 2777926842], length 1368
02:05:30.361189 IP 192.168.3.3.60950 > 120.77.37.121.8090: Flags [.], seq 164297:165665, ack 1, win 2052, options [nop,nop,TS val 293520324 ecr 2777926842], length 1368
02:05:30.361190 IP 192.168.3.3.60950 > 120.77.37.121.8090: Flags [.], seq 165665:167033, ack 1, win 2052, options [nop,nop,TS val 293520324 ecr 2777926842], length 1368
02:05:30.361192 IP 192.168.3.3.60950 > 120.77.37.121.8090: Flags [.], seq 167033:168401, ack 1, win 2052, options [nop,nop,TS val 293520324 ecr 2777926842], length 1368
02:05:30.361193 IP 192.168.3.3.60950 > 120.77.37.121.8090: Flags [.], seq 168401:169769, ack 1, win 2052, options [nop,nop,TS val 293520324 ecr 2777926842], length 1368
02:05:30.361194 IP 192.168.3.3.60950 > 120.77.37.121.8090: Flags [.], seq 169769:171137, ack 1, win 2052, options [nop,nop,TS val 293520324 ecr 2777926842], length 1368
02:05:30.361196 IP 192.168.3.3.60950 > 120.77.37.121.8090: Flags [.], seq 171137:172505, ack 1, win 2052, options [nop,nop,TS val 293520324 ecr 2777926842], length 1368
02:05:30.361198 IP 192.168.3.3.60950 > 120.77.37.121.8090: Flags [.], seq 172505:173873, ack 1, win 2052, options [nop,nop,TS val 293520324 ecr 2777926842], length 1368
02:05:30.361200 IP 192.168.3.3.60950 > 120.77.37.121.8090: Flags [.], seq 173873:175241, ack 1, win 2052, options [nop,nop,TS val 293520324 ecr 2777926842], length 1368
02:05:30.361210 IP 192.168.3.3.60950 > 120.77.37.121.8090: Flags [.], seq 175241:176609, ack 1, win 2052, options [nop,nop,TS val 293520324 ecr 2777926842], length 1368
02:05:30.426156 IP 120.77.37.121.8090 > 192.168.3.3.60950: Flags [.], ack 176609, win 409, options [nop,nop,TS val 2777926905 ecr 293520324], length 0
02:05:30.426235 IP 192.168.3.3.60950 > 120.77.37.121.8090: Flags [.], seq 176609:177977, ack 1, win 2052, options [nop,nop,TS val 293520389 ecr 2777926905], length 1368
02:05:30.426242 IP 192.168.3.3.60950 > 120.77.37.121.8090: Flags [.], seq 177977:179345, ack 1, win 2052, options [nop,nop,TS val 293520389 ecr 2777926905], length 1368
02:05:30.426245 IP 192.168.3.3.60950 > 120.77.37.121.8090: Flags [.], seq 179345:180713, ack 1, win 2052, options [nop,nop,TS val 293520389 ecr 2777926905], length 1368
02:05:30.426247 IP 192.168.3.3.60950 > 120.77.37.121.8090: Flags [.], seq 180713:182081, ack 1, win 2052, options [nop,nop,TS val 293520389 ecr 2777926905], length 1368
02:05:30.426249 IP 192.168.3.3.60950 > 120.77.37.121.8090: Flags [.], seq 182081:183449, ack 1, win 2052, options [nop,nop,TS val 293520389 ecr 2777926905], length 1368
02:05:30.426251 IP 192.168.3.3.60950 > 120.77.37.121.8090: Flags [.], seq 183449:184817, ack 1, win 2052, options [nop,nop,TS val 293520389 ecr 2777926905], length 1368
02:05:30.426253 IP 192.168.3.3.60950 > 120.77.37.121.8090: Flags [.], seq 184817:186185, ack 1, win 2052, options [nop,nop,TS val 293520389 ecr 2777926905], length 1368
02:05:30.426255 IP 192.168.3.3.60950 > 120.77.37.121.8090: Flags [.], seq 186185:187553, ack 1, win 2052, options [nop,nop,TS val 293520389 ecr 2777926905], length 1368
02:05:30.426257 IP 192.168.3.3.60950 > 120.77.37.121.8090: Flags [.], seq 187553:188921, ack 1, win 2052, options [nop,nop,TS val 293520389 ecr 2777926905], length 1368
02:05:30.426259 IP 192.168.3.3.60950 > 120.77.37.121.8090: Flags [.], seq 188921:190289, ack 1, win 2052, options [nop,nop,TS val 293520389 ecr 2777926905], length 1368
02:05:30.426260 IP 192.168.3.3.60950 > 120.77.37.121.8090: Flags [.], seq 190289:191657, ack 1, win 2052, options [nop,nop,TS val 293520389 ecr 2777926905], length 1368
02:05:30.426262 IP 192.168.3.3.60950 > 120.77.37.121.8090: Flags [.], seq 191657:193025, ack 1, win 2052, options [nop,nop,TS val 293520389 ecr 2777926905], length 1368
02:05:30.426264 IP 192.168.3.3.60950 > 120.77.37.121.8090: Flags [.], seq 193025:194393, ack 1, win 2052, options [nop,nop,TS val 293520389 ecr 2777926905], length 1368
02:05:30.426266 IP 192.168.3.3.60950 > 120.77.37.121.8090: Flags [.], seq 194393:195761, ack 1, win 2052, options [nop,nop,TS val 293520389 ecr 2777926905], length 1368
02:05:30.426268 IP 192.168.3.3.60950 > 120.77.37.121.8090: Flags [.], seq 195761:197129, ack 1, win 2052, options [nop,nop,TS val 293520389 ecr 2777926905], length 1368
02:05:30.426270 IP 192.168.3.3.60950 > 120.77.37.121.8090: Flags [.], seq 197129:198497, ack 1, win 2052, options [nop,nop,TS val 293520389 ecr 2777926905], length 1368
02:05:30.426271 IP 192.168.3.3.60950 > 120.77.37.121.8090: Flags [.], seq 198497:199865, ack 1, win 2052, options [nop,nop,TS val 293520389 ecr 2777926905], length 1368
02:05:30.426273 IP 192.168.3.3.60950 > 120.77.37.121.8090: Flags [P.], seq 199865:200001, ack 1, win 2052, options [nop,nop,TS val 293520389 ecr 2777926905], length 136
02:05:30.458215 IP 120.77.37.121.8090 > 192.168.3.3.60950: Flags [.], ack 183449, win 628, options [nop,nop,TS val 2777926938 ecr 293520389], length 0
02:05:30.499853 IP 120.77.37.121.8090 > 192.168.3.3.60950: Flags [.], ack 200001, win 499, options [nop,nop,TS val 2777926979 ecr 293520389], length 0
02:05:31.095988 IP 192.168.3.3.60950 > 120.77.37.121.8090: Flags [.], seq 200001:201369, ack 1, win 2052, options [nop,nop,TS val 293521056 ecr 2777926979], length 1368
02:05:31.095998 IP 192.168.3.3.60950 > 120.77.37.121.8090: Flags [.], seq 201369:202737, ack 1, win 2052, options [nop,nop,TS val 293521056 ecr 2777926979], length 1368
02:05:31.096000 IP 192.168.3.3.60950 > 120.77.37.121.8090: Flags [.], seq 202737:204105, ack 1, win 2052, options [nop,nop,TS val 293521056 ecr 2777926979], length 1368
02:05:31.096002 IP 192.168.3.3.60950 > 120.77.37.121.8090: Flags [.], seq 204105:205473, ack 1, win 2052, options [nop,nop,TS val 293521056 ecr 2777926979], length 1368
02:05:31.096003 IP 192.168.3.3.60950 > 120.77.37.121.8090: Flags [.], seq 205473:206841, ack 1, win 2052, options [nop,nop,TS val 293521056 ecr 2777926979], length 1368
02:05:31.096004 IP 192.168.3.3.60950 > 120.77.37.121.8090: Flags [.], seq 206841:208209, ack 1, win 2052, options [nop,nop,TS val 293521056 ecr 2777926979], length 1368
02:05:31.096006 IP 192.168.3.3.60950 > 120.77.37.121.8090: Flags [.], seq 208209:209577, ack 1, win 2052, options [nop,nop,TS val 293521056 ecr 2777926979], length 1368
02:05:31.096007 IP 192.168.3.3.60950 > 120.77.37.121.8090: Flags [.], seq 209577:210945, ack 1, win 2052, options [nop,nop,TS val 293521056 ecr 2777926979], length 1368
02:05:31.096009 IP 192.168.3.3.60950 > 120.77.37.121.8090: Flags [.], seq 210945:212313, ack 1, win 2052, options [nop,nop,TS val 293521056 ecr 2777926979], length 1368
02:05:31.096010 IP 192.168.3.3.60950 > 120.77.37.121.8090: Flags [.], seq 212313:213681, ack 1, win 2052, options [nop,nop,TS val 293521056 ecr 2777926979], length 1368
02:05:31.096011 IP 192.168.3.3.60950 > 120.77.37.121.8090: Flags [.], seq 213681:215049, ack 1, win 2052, options [nop,nop,TS val 293521056 ecr 2777926979], length 1368
02:05:31.096012 IP 192.168.3.3.60950 > 120.77.37.121.8090: Flags [.], seq 215049:216417, ack 1, win 2052, options [nop,nop,TS val 293521056 ecr 2777926979], length 1368
02:05:31.096013 IP 192.168.3.3.60950 > 120.77.37.121.8090: Flags [.], seq 216417:217785, ack 1, win 2052, options [nop,nop,TS val 293521056 ecr 2777926979], length 1368
02:05:31.096015 IP 192.168.3.3.60950 > 120.77.37.121.8090: Flags [.], seq 217785:219153, ack 1, win 2052, options [nop,nop,TS val 293521056 ecr 2777926979], length 1368
02:05:31.096077 IP 192.168.3.3.60950 > 120.77.37.121.8090: Flags [.], seq 219153:220521, ack 1, win 2052, options [nop,nop,TS val 293521056 ecr 2777926979], length 1368
02:05:31.096079 IP 192.168.3.3.60950 > 120.77.37.121.8090: Flags [.], seq 220521:221889, ack 1, win 2052, options [nop,nop,TS val 293521056 ecr 2777926979], length 1368
02:05:31.096080 IP 192.168.3.3.60950 > 120.77.37.121.8090: Flags [.], seq 221889:223257, ack 1, win 2052, options [nop,nop,TS val 293521056 ecr 2777926979], length 1368
02:05:31.096081 IP 192.168.3.3.60950 > 120.77.37.121.8090: Flags [.], seq 223257:224625, ack 1, win 2052, options [nop,nop,TS val 293521056 ecr 2777926979], length 1368
02:05:31.096083 IP 192.168.3.3.60950 > 120.77.37.121.8090: Flags [.], seq 224625:225993, ack 1, win 2052, options [nop,nop,TS val 293521056 ecr 2777926979], length 1368
02:05:31.096084 IP 192.168.3.3.60950 > 120.77.37.121.8090: Flags [.], seq 225993:227361, ack 1, win 2052, options [nop,nop,TS val 293521056 ecr 2777926979], length 1368
02:05:31.096086 IP 192.168.3.3.60950 > 120.77.37.121.8090: Flags [.], seq 227361:228729, ack 1, win 2052, options [nop,nop,TS val 293521056 ecr 2777926979], length 1368
02:05:31.121654 IP 120.77.37.121.8090 > 192.168.3.3.60950: Flags [.], ack 201369, win 489, options [nop,nop,TS val 2777927601 ecr 293521056], length 0
02:05:31.121872 IP 192.168.3.3.60950 > 120.77.37.121.8090: Flags [.], seq 228729:230097, ack 1, win 2052, options [nop,nop,TS val 293521081 ecr 2777927601], length 1368
02:05:31.121908 IP 192.168.3.3.60950 > 120.77.37.121.8090: Flags [.], seq 230097:231465, ack 1, win 2052, options [nop,nop,TS val 293521081 ecr 2777927601], length 1368
02:05:31.167903 IP 120.77.37.121.8090 > 192.168.3.3.60950: Flags [.], ack 231465, win 422, options [nop,nop,TS val 2777927649 ecr 293521056], length 0
02:05:31.167988 IP 192.168.3.3.60950 > 120.77.37.121.8090: Flags [.], seq 231465:232833, ack 1, win 2052, options [nop,nop,TS val 293521127 ecr 2777927649], length 1368
02:05:31.167995 IP 192.168.3.3.60950 > 120.77.37.121.8090: Flags [.], seq 232833:234201, ack 1, win 2052, options [nop,nop,TS val 293521127 ecr 2777927649], length 1368
02:05:31.167998 IP 192.168.3.3.60950 > 120.77.37.121.8090: Flags [.], seq 234201:235569, ack 1, win 2052, options [nop,nop,TS val 293521127 ecr 2777927649], length 1368
02:05:31.167999 IP 192.168.3.3.60950 > 120.77.37.121.8090: Flags [.], seq 235569:236937, ack 1, win 2052, options [nop,nop,TS val 293521127 ecr 2777927649], length 1368
02:05:31.168001 IP 192.168.3.3.60950 > 120.77.37.121.8090: Flags [.], seq 236937:238305, ack 1, win 2052, options [nop,nop,TS val 293521127 ecr 2777927649], length 1368
02:05:31.168002 IP 192.168.3.3.60950 > 120.77.37.121.8090: Flags [.], seq 238305:239673, ack 1, win 2052, options [nop,nop,TS val 293521127 ecr 2777927649], length 1368
02:05:31.168004 IP 192.168.3.3.60950 > 120.77.37.121.8090: Flags [.], seq 239673:241041, ack 1, win 2052, options [nop,nop,TS val 293521127 ecr 2777927649], length 1368
02:05:31.168005 IP 192.168.3.3.60950 > 120.77.37.121.8090: Flags [.], seq 241041:242409, ack 1, win 2052, options [nop,nop,TS val 293521127 ecr 2777927649], length 1368
02:05:31.168007 IP 192.168.3.3.60950 > 120.77.37.121.8090: Flags [.], seq 242409:243777, ack 1, win 2052, options [nop,nop,TS val 293521127 ecr 2777927649], length 1368
02:05:31.168008 IP 192.168.3.3.60950 > 120.77.37.121.8090: Flags [.], seq 243777:245145, ack 1, win 2052, options [nop,nop,TS val 293521127 ecr 2777927649], length 1368
02:05:31.168010 IP 192.168.3.3.60950 > 120.77.37.121.8090: Flags [.], seq 245145:246513, ack 1, win 2052, options [nop,nop,TS val 293521127 ecr 2777927649], length 1368
02:05:31.168011 IP 192.168.3.3.60950 > 120.77.37.121.8090: Flags [.], seq 246513:247881, ack 1, win 2052, options [nop,nop,TS val 293521127 ecr 2777927649], length 1368
02:05:31.168013 IP 192.168.3.3.60950 > 120.77.37.121.8090: Flags [.], seq 247881:249249, ack 1, win 2052, options [nop,nop,TS val 293521127 ecr 2777927649], length 1368
02:05:31.168014 IP 192.168.3.3.60950 > 120.77.37.121.8090: Flags [.], seq 249249:250617, ack 1, win 2052, options [nop,nop,TS val 293521127 ecr 2777927649], length 1368
02:05:31.168016 IP 192.168.3.3.60950 > 120.77.37.121.8090: Flags [.], seq 250617:251985, ack 1, win 2052, options [nop,nop,TS val 293521127 ecr 2777927649], length 1368
02:05:31.168017 IP 192.168.3.3.60950 > 120.77.37.121.8090: Flags [.], seq 251985:253353, ack 1, win 2052, options [nop,nop,TS val 293521127 ecr 2777927649], length 1368
02:05:31.168019 IP 192.168.3.3.60950 > 120.77.37.121.8090: Flags [.], seq 253353:254721, ack 1, win 2052, options [nop,nop,TS val 293521127 ecr 2777927649], length 1368
02:05:31.168020 IP 192.168.3.3.60950 > 120.77.37.121.8090: Flags [.], seq 254721:256089, ack 1, win 2052, options [nop,nop,TS val 293521127 ecr 2777927649], length 1368
02:05:31.168022 IP 192.168.3.3.60950 > 120.77.37.121.8090: Flags [.], seq 256089:257457, ack 1, win 2052, options [nop,nop,TS val 293521127 ecr 2777927649], length 1368
02:05:31.168023 IP 192.168.3.3.60950 > 120.77.37.121.8090: Flags [.], seq 257457:258825, ack 1, win 2052, options [nop,nop,TS val 293521127 ecr 2777927649], length 1368
02:05:31.168025 IP 192.168.3.3.60950 > 120.77.37.121.8090: Flags [.], seq 258825:260193, ack 1, win 2052, options [nop,nop,TS val 293521127 ecr 2777927649], length 1368
02:05:31.168026 IP 192.168.3.3.60950 > 120.77.37.121.8090: Flags [.], seq 260193:261561, ack 1, win 2052, options [nop,nop,TS val 293521127 ecr 2777927649], length 1368
02:05:31.168028 IP 192.168.3.3.60950 > 120.77.37.121.8090: Flags [.], seq 261561:262929, ack 1, win 2052, options [nop,nop,TS val 293521127 ecr 2777927649], length 1368
02:05:31.168030 IP 192.168.3.3.60950 > 120.77.37.121.8090: Flags [.], seq 262929:264297, ack 1, win 2052, options [nop,nop,TS val 293521127 ecr 2777927649], length 1368
02:05:31.242453 IP 120.77.37.121.8090 > 192.168.3.3.60950: Flags [.], ack 264297, win 166, options [nop,nop,TS val 2777927723 ecr 293521127], length 0
02:05:31.242512 IP 192.168.3.3.60950 > 120.77.37.121.8090: Flags [.], seq 264297:265665, ack 1, win 2052, options [nop,nop,TS val 293521201 ecr 2777927723], length 1368
02:05:31.242521 IP 192.168.3.3.60950 > 120.77.37.121.8090: Flags [.], seq 265665:267033, ack 1, win 2052, options [nop,nop,TS val 293521201 ecr 2777927723], length 1368
02:05:31.242523 IP 192.168.3.3.60950 > 120.77.37.121.8090: Flags [.], seq 267033:268401, ack 1, win 2052, options [nop,nop,TS val 293521201 ecr 2777927723], length 1368
02:05:31.242524 IP 192.168.3.3.60950 > 120.77.37.121.8090: Flags [.], seq 268401:269769, ack 1, win 2052, options [nop,nop,TS val 293521201 ecr 2777927723], length 1368
02:05:31.242526 IP 192.168.3.3.60950 > 120.77.37.121.8090: Flags [.], seq 269769:271137, ack 1, win 2052, options [nop,nop,TS val 293521201 ecr 2777927723], length 1368
02:05:31.242528 IP 192.168.3.3.60950 > 120.77.37.121.8090: Flags [.], seq 271137:272505, ack 1, win 2052, options [nop,nop,TS val 293521201 ecr 2777927723], length 1368
02:05:31.242529 IP 192.168.3.3.60950 > 120.77.37.121.8090: Flags [.], seq 272505:273873, ack 1, win 2052, options [nop,nop,TS val 293521201 ecr 2777927723], length 1368
02:05:31.242531 IP 192.168.3.3.60950 > 120.77.37.121.8090: Flags [.], seq 273873:275241, ack 1, win 2052, options [nop,nop,TS val 293521201 ecr 2777927723], length 1368
02:05:31.242533 IP 192.168.3.3.60950 > 120.77.37.121.8090: Flags [.], seq 275241:276609, ack 1, win 2052, options [nop,nop,TS val 293521201 ecr 2777927723], length 1368
02:05:31.242534 IP 192.168.3.3.60950 > 120.77.37.121.8090: Flags [.], seq 276609:277977, ack 1, win 2052, options [nop,nop,TS val 293521201 ecr 2777927723], length 1368
02:05:31.242536 IP 192.168.3.3.60950 > 120.77.37.121.8090: Flags [.], seq 277977:279345, ack 1, win 2052, options [nop,nop,TS val 293521201 ecr 2777927723], length 1368
02:05:31.242537 IP 192.168.3.3.60950 > 120.77.37.121.8090: Flags [.], seq 279345:280713, ack 1, win 2052, options [nop,nop,TS val 293521201 ecr 2777927723], length 1368
02:05:31.242538 IP 192.168.3.3.60950 > 120.77.37.121.8090: Flags [.], seq 280713:282081, ack 1, win 2052, options [nop,nop,TS val 293521201 ecr 2777927723], length 1368
02:05:31.242547 IP 192.168.3.3.60950 > 120.77.37.121.8090: Flags [.], seq 282081:283449, ack 1, win 2052, options [nop,nop,TS val 293521201 ecr 2777927723], length 1368
02:05:31.242549 IP 192.168.3.3.60950 > 120.77.37.121.8090: Flags [.], seq 283449:284817, ack 1, win 2052, options [nop,nop,TS val 293521201 ecr 2777927723], length 1368
02:05:31.268705 IP 120.77.37.121.8090 > 192.168.3.3.60950: Flags [.], ack 267033, win 263, options [nop,nop,TS val 2777927747 ecr 293521201], length 0
02:05:31.268786 IP 192.168.3.3.60950 > 120.77.37.121.8090: Flags [.], seq 284817:286185, ack 1, win 2052, options [nop,nop,TS val 293521227 ecr 2777927747], length 1368
02:05:31.268798 IP 192.168.3.3.60950 > 120.77.37.121.8090: Flags [.], seq 286185:287553, ack 1, win 2052, options [nop,nop,TS val 293521227 ecr 2777927747], length 1368
02:05:31.268801 IP 192.168.3.3.60950 > 120.77.37.121.8090: Flags [.], seq 287553:288921, ack 1, win 2052, options [nop,nop,TS val 293521227 ecr 2777927747], length 1368
02:05:31.268804 IP 192.168.3.3.60950 > 120.77.37.121.8090: Flags [.], seq 288921:290289, ack 1, win 2052, options [nop,nop,TS val 293521227 ecr 2777927747], length 1368
02:05:31.268806 IP 192.168.3.3.60950 > 120.77.37.121.8090: Flags [.], seq 290289:291657, ack 1, win 2052, options [nop,nop,TS val 293521227 ecr 2777927747], length 1368
02:05:31.268808 IP 192.168.3.3.60950 > 120.77.37.121.8090: Flags [.], seq 291657:293025, ack 1, win 2052, options [nop,nop,TS val 293521227 ecr 2777927747], length 1368
02:05:31.268810 IP 192.168.3.3.60950 > 120.77.37.121.8090: Flags [.], seq 293025:294393, ack 1, win 2052, options [nop,nop,TS val 293521227 ecr 2777927747], length 1368
02:05:31.268812 IP 192.168.3.3.60950 > 120.77.37.121.8090: Flags [.], seq 294393:295761, ack 1, win 2052, options [nop,nop,TS val 293521227 ecr 2777927747], length 1368
02:05:31.268814 IP 192.168.3.3.60950 > 120.77.37.121.8090: Flags [.], seq 295761:297129, ack 1, win 2052, options [nop,nop,TS val 293521227 ecr 2777927747], length 1368
02:05:31.268817 IP 192.168.3.3.60950 > 120.77.37.121.8090: Flags [.], seq 297129:298497, ack 1, win 2052, options [nop,nop,TS val 293521227 ecr 2777927747], length 1368
02:05:31.268831 IP 192.168.3.3.60950 > 120.77.37.121.8090: Flags [.], seq 298497:299865, ack 1, win 2052, options [nop,nop,TS val 293521227 ecr 2777927747], length 1368
02:05:31.268836 IP 192.168.3.3.60950 > 120.77.37.121.8090: Flags [P.], seq 299865:300001, ack 1, win 2052, options [nop,nop,TS val 293521227 ecr 2777927747], length 136
02:05:31.301846 IP 120.77.37.121.8090 > 192.168.3.3.60950: Flags [.], ack 295761, win 153, options [nop,nop,TS val 2777927783 ecr 293521201], length 0
02:05:31.345054 IP 120.77.37.121.8090 > 192.168.3.3.60950: Flags [.], ack 300001, win 120, options [nop,nop,TS val 2777927824 ecr 293521227], length 0
02:05:32.151585 IP 192.168.3.3.60950 > 120.77.37.121.8090: Flags [.], seq 300001:301369, ack 1, win 2052, options [nop,nop,TS val 293522108 ecr 2777927824], length 1368
02:05:32.151595 IP 192.168.3.3.60950 > 120.77.37.121.8090: Flags [.], seq 301369:302737, ack 1, win 2052, options [nop,nop,TS val 293522108 ecr 2777927824], length 1368
02:05:32.151598 IP 192.168.3.3.60950 > 120.77.37.121.8090: Flags [.], seq 302737:304105, ack 1, win 2052, options [nop,nop,TS val 293522108 ecr 2777927824], length 1368
02:05:32.151601 IP 192.168.3.3.60950 > 120.77.37.121.8090: Flags [.], seq 304105:305473, ack 1, win 2052, options [nop,nop,TS val 293522108 ecr 2777927824], length 1368
02:05:32.151603 IP 192.168.3.3.60950 > 120.77.37.121.8090: Flags [.], seq 305473:306841, ack 1, win 2052, options [nop,nop,TS val 293522108 ecr 2777927824], length 1368
02:05:32.151605 IP 192.168.3.3.60950 > 120.77.37.121.8090: Flags [.], seq 306841:308209, ack 1, win 2052, options [nop,nop,TS val 293522108 ecr 2777927824], length 1368
02:05:32.151606 IP 192.168.3.3.60950 > 120.77.37.121.8090: Flags [.], seq 308209:309577, ack 1, win 2052, options [nop,nop,TS val 293522108 ecr 2777927824], length 1368
02:05:32.151608 IP 192.168.3.3.60950 > 120.77.37.121.8090: Flags [.], seq 309577:310945, ack 1, win 2052, options [nop,nop,TS val 293522108 ecr 2777927824], length 1368
02:05:32.151610 IP 192.168.3.3.60950 > 120.77.37.121.8090: Flags [.], seq 310945:312313, ack 1, win 2052, options [nop,nop,TS val 293522108 ecr 2777927824], length 1368
02:05:32.151612 IP 192.168.3.3.60950 > 120.77.37.121.8090: Flags [.], seq 312313:313681, ack 1, win 2052, options [nop,nop,TS val 293522108 ecr 2777927824], length 1368
02:05:32.151614 IP 192.168.3.3.60950 > 120.77.37.121.8090: Flags [.], seq 313681:315049, ack 1, win 2052, options [nop,nop,TS val 293522108 ecr 2777927824], length 1368
02:05:32.179910 IP 120.77.37.121.8090 > 192.168.3.3.60950: Flags [.], ack 301369, win 110, options [nop,nop,TS val 2777928661 ecr 293522108], length 0
02:05:32.193393 IP 120.77.37.121.8090 > 192.168.3.3.60950: Flags [.], ack 309577, win 168, options [nop,nop,TS val 2777928674 ecr 293522108], length 0
02:05:32.193434 IP 192.168.3.3.60950 > 120.77.37.121.8090: Flags [.], seq 315049:316417, ack 1, win 2052, options [nop,nop,TS val 293522149 ecr 2777928674], length 1368
02:05:32.193438 IP 192.168.3.3.60950 > 120.77.37.121.8090: Flags [.], seq 316417:317785, ack 1, win 2052, options [nop,nop,TS val 293522149 ecr 2777928674], length 1368
02:05:32.193439 IP 192.168.3.3.60950 > 120.77.37.121.8090: Flags [.], seq 317785:319153, ack 1, win 2052, options [nop,nop,TS val 293522149 ecr 2777928674], length 1368
02:05:32.193440 IP 192.168.3.3.60950 > 120.77.37.121.8090: Flags [.], seq 319153:320521, ack 1, win 2052, options [nop,nop,TS val 293522149 ecr 2777928674], length 1368
02:05:32.193441 IP 192.168.3.3.60950 > 120.77.37.121.8090: Flags [.], seq 320521:321889, ack 1, win 2052, options [nop,nop,TS val 293522149 ecr 2777928674], length 1368
02:05:32.193442 IP 192.168.3.3.60950 > 120.77.37.121.8090: Flags [.], seq 321889:323257, ack 1, win 2052, options [nop,nop,TS val 293522149 ecr 2777928674], length 1368
02:05:32.193443 IP 192.168.3.3.60950 > 120.77.37.121.8090: Flags [.], seq 323257:324625, ack 1, win 2052, options [nop,nop,TS val 293522149 ecr 2777928674], length 1368
02:05:32.193444 IP 192.168.3.3.60950 > 120.77.37.121.8090: Flags [.], seq 324625:325993, ack 1, win 2052, options [nop,nop,TS val 293522149 ecr 2777928674], length 1368
02:05:32.193445 IP 192.168.3.3.60950 > 120.77.37.121.8090: Flags [.], seq 325993:327361, ack 1, win 2052, options [nop,nop,TS val 293522149 ecr 2777928674], length 1368
02:05:32.193445 IP 192.168.3.3.60950 > 120.77.37.121.8090: Flags [.], seq 327361:328729, ack 1, win 2052, options [nop,nop,TS val 293522149 ecr 2777928674], length 1368
02:05:32.193446 IP 192.168.3.3.60950 > 120.77.37.121.8090: Flags [.], seq 328729:330097, ack 1, win 2052, options [nop,nop,TS val 293522149 ecr 2777928674], length 1368
02:05:32.227449 IP 120.77.37.121.8090 > 192.168.3.3.60950: Flags [.], ack 319153, win 94, options [nop,nop,TS val 2777928705 ecr 293522108], length 0
02:05:32.228933 IP 120.77.37.121.8090 > 192.168.3.3.60950: Flags [.], ack 325993, win 113, options [nop,nop,TS val 2777928709 ecr 293522149], length 0
02:05:32.228979 IP 192.168.3.3.60950 > 120.77.37.121.8090: Flags [.], seq 330097:331465, ack 1, win 2052, options [nop,nop,TS val 293522184 ecr 2777928709], length 1368
02:05:32.228986 IP 192.168.3.3.60950 > 120.77.37.121.8090: Flags [.], seq 331465:332833, ack 1, win 2052, options [nop,nop,TS val 293522184 ecr 2777928709], length 1368
02:05:32.228988 IP 192.168.3.3.60950 > 120.77.37.121.8090: Flags [.], seq 332833:334201, ack 1, win 2052, options [nop,nop,TS val 293522184 ecr 2777928709], length 1368
02:05:32.228989 IP 192.168.3.3.60950 > 120.77.37.121.8090: Flags [.], seq 334201:335569, ack 1, win 2052, options [nop,nop,TS val 293522184 ecr 2777928709], length 1368
02:05:32.228991 IP 192.168.3.3.60950 > 120.77.37.121.8090: Flags [.], seq 335569:336937, ack 1, win 2052, options [nop,nop,TS val 293522184 ecr 2777928709], length 1368
02:05:32.228992 IP 192.168.3.3.60950 > 120.77.37.121.8090: Flags [.], seq 336937:338305, ack 1, win 2052, options [nop,nop,TS val 293522184 ecr 2777928709], length 1368
02:05:32.228994 IP 192.168.3.3.60950 > 120.77.37.121.8090: Flags [.], seq 338305:339673, ack 1, win 2052, options [nop,nop,TS val 293522184 ecr 2777928709], length 1368
02:05:32.260763 IP 120.77.37.121.8090 > 192.168.3.3.60950: Flags [.], ack 334201, win 49, options [nop,nop,TS val 2777928742 ecr 293522149], length 0
02:05:32.303139 IP 120.77.37.121.8090 > 192.168.3.3.60950: Flags [.], ack 339673, win 7, options [nop,nop,TS val 2777928782 ecr 293522184], length 0
02:05:37.305913 IP 192.168.3.3.60950 > 120.77.37.121.8090: Flags [.], seq 339673:340569, ack 1, win 2052, options [nop,nop,TS val 293527256 ecr 2777928782], length 896
02:05:37.333850 IP 120.77.37.121.8090 > 192.168.3.3.60950: Flags [.], ack 340569, win 0, options [nop,nop,TS val 2777933812 ecr 293527256], length 0
02:05:42.338173 IP 192.168.3.3.60950 > 120.77.37.121.8090: Flags [.], seq 340569:340570, ack 1, win 2052, options [nop,nop,TS val 293532283 ecr 2777933812], length 1
02:05:42.361470 IP 120.77.37.121.8090 > 192.168.3.3.60950: Flags [.], ack 340569, win 0, options [nop,nop,TS val 2777938842 ecr 293532283], length 0
02:05:47.341420 IP 192.168.3.3.60950 > 120.77.37.121.8090: Flags [.], seq 340569:340570, ack 1, win 2052, options [nop,nop,TS val 293537283 ecr 2777938842], length 1
02:05:47.369106 IP 120.77.37.121.8090 > 192.168.3.3.60950: Flags [.], ack 340569, win 0, options [nop,nop,TS val 2777943849 ecr 293537283], length 0
02:05:52.346196 IP 192.168.3.3.60950 > 120.77.37.121.8090: Flags [.], seq 340569:340570, ack 1, win 2052, options [nop,nop,TS val 293542283 ecr 2777943849], length 1
02:05:52.370227 IP 120.77.37.121.8090 > 192.168.3.3.60950: Flags [.], ack 340569, win 0, options [nop,nop,TS val 2777948848 ecr 293542283], length 0
02:05:54.108014 IP 120.77.37.121.8090 > 192.168.3.3.60950: Flags [.], ack 340569, win 106, options [nop,nop,TS val 2777950540 ecr 293542283], length 0
02:05:54.108073 IP 192.168.3.3.60950 > 120.77.37.121.8090: Flags [.], seq 340569:341937, ack 1, win 2052, options [nop,nop,TS val 293544044 ecr 2777950540], length 1368
02:05:54.108079 IP 192.168.3.3.60950 > 120.77.37.121.8090: Flags [.], seq 341937:343305, ack 1, win 2052, options [nop,nop,TS val 293544044 ecr 2777950540], length 1368
02:05:54.108084 IP 192.168.3.3.60950 > 120.77.37.121.8090: Flags [.], seq 343305:344673, ack 1, win 2052, options [nop,nop,TS val 293544044 ecr 2777950540], length 1368
02:05:54.108089 IP 192.168.3.3.60950 > 120.77.37.121.8090: Flags [.], seq 344673:346041, ack 1, win 2052, options [nop,nop,TS val 293544044 ecr 2777950540], length 1368
02:05:54.108095 IP 192.168.3.3.60950 > 120.77.37.121.8090: Flags [.], seq 346041:347409, ack 1, win 2052, options [nop,nop,TS val 293544044 ecr 2777950540], length 1368
02:05:54.108102 IP 192.168.3.3.60950 > 120.77.37.121.8090: Flags [.], seq 347409:348777, ack 1, win 2052, options [nop,nop,TS val 293544044 ecr 2777950540], length 1368
02:05:54.108111 IP 192.168.3.3.60950 > 120.77.37.121.8090: Flags [.], seq 348777:350145, ack 1, win 2052, options [nop,nop,TS val 293544044 ecr 2777950540], length 1368
02:05:54.108122 IP 192.168.3.3.60950 > 120.77.37.121.8090: Flags [.], seq 350145:351513, ack 1, win 2052, options [nop,nop,TS val 293544044 ecr 2777950540], length 1368
02:05:54.108130 IP 192.168.3.3.60950 > 120.77.37.121.8090: Flags [.], seq 351513:352881, ack 1, win 2052, options [nop,nop,TS val 293544044 ecr 2777950540], length 1368
02:05:54.152782 IP 120.77.37.121.8090 > 192.168.3.3.60950: Flags [.], ack 341937, win 96, options [nop,nop,TS val 2777950621 ecr 293544044], length 0
02:05:54.152788 IP 120.77.37.121.8090 > 192.168.3.3.60950: Flags [.], ack 343305, win 86, options [nop,nop,TS val 2777950622 ecr 293544044,nop,nop,sack 1 {344673:346041}], length 0
02:05:54.152789 IP 120.77.37.121.8090 > 192.168.3.3.60950: Flags [.], ack 343305, win 86, options [nop,nop,TS val 2777950624 ecr 293544044,nop,nop,sack 1 {344673:347409}], length 0
02:05:54.152791 IP 120.77.37.121.8090 > 192.168.3.3.60950: Flags [.], ack 343305, win 86, options [nop,nop,TS val 2777950625 ecr 293544044,nop,nop,sack 1 {344673:350145}], length 0
02:05:54.152792 IP 120.77.37.121.8090 > 192.168.3.3.60950: Flags [.], ack 350145, win 121, options [nop,nop,TS val 2777950626 ecr 293544044], length 0
02:05:54.152829 IP 192.168.3.3.60950 > 120.77.37.121.8090: Flags [.], seq 352881:354249, ack 1, win 2052, options [nop,nop,TS val 293544088 ecr 2777950622], length 1368
02:05:54.152851 IP 192.168.3.3.60950 > 120.77.37.121.8090: Flags [.], seq 354249:355617, ack 1, win 2052, options [nop,nop,TS val 293544088 ecr 2777950626], length 1368
02:05:54.152861 IP 192.168.3.3.60950 > 120.77.37.121.8090: Flags [.], seq 355617:356985, ack 1, win 2052, options [nop,nop,TS val 293544088 ecr 2777950626], length 1368
02:05:54.152870 IP 192.168.3.3.60950 > 120.77.37.121.8090: Flags [.], seq 356985:358353, ack 1, win 2052, options [nop,nop,TS val 293544088 ecr 2777950626], length 1368
02:05:54.152876 IP 192.168.3.3.60950 > 120.77.37.121.8090: Flags [.], seq 358353:359721, ack 1, win 2052, options [nop,nop,TS val 293544088 ecr 2777950626], length 1368
02:05:54.152884 IP 192.168.3.3.60950 > 120.77.37.121.8090: Flags [.], seq 359721:361089, ack 1, win 2052, options [nop,nop,TS val 293544088 ecr 2777950626], length 1368
02:05:54.152890 IP 192.168.3.3.60950 > 120.77.37.121.8090: Flags [.], seq 361089:362457, ack 1, win 2052, options [nop,nop,TS val 293544088 ecr 2777950626], length 1368
02:05:54.152897 IP 192.168.3.3.60950 > 120.77.37.121.8090: Flags [.], seq 362457:363825, ack 1, win 2052, options [nop,nop,TS val 293544088 ecr 2777950626], length 1368
02:05:54.152904 IP 192.168.3.3.60950 > 120.77.37.121.8090: Flags [.], seq 363825:365193, ack 1, win 2052, options [nop,nop,TS val 293544088 ecr 2777950626], length 1368
02:05:54.177755 IP 120.77.37.121.8090 > 192.168.3.3.60950: Flags [.], ack 354249, win 89, options [nop,nop,TS val 2777950657 ecr 293544044], length 0
02:05:54.229407 IP 120.77.37.121.8090 > 192.168.3.3.60950: Flags [.], ack 365193, win 4, options [nop,nop,TS val 2777950698 ecr 293544088], length 0
02:05:59.233574 IP 192.168.3.3.60950 > 120.77.37.121.8090: Flags [.], seq 365193:365705, ack 1, win 2052, options [nop,nop,TS val 293549163 ecr 2777950698], length 512
02:05:59.255230 IP 120.77.37.121.8090 > 192.168.3.3.60950: Flags [.], ack 365705, win 0, options [nop,nop,TS val 2777955736 ecr 293549163], length 0
02:06:04.264984 IP 192.168.3.3.60950 > 120.77.37.121.8090: Flags [.], seq 365705:365706, ack 1, win 2052, options [nop,nop,TS val 293554184 ecr 2777955736], length 1
02:06:04.287096 IP 120.77.37.121.8090 > 192.168.3.3.60950: Flags [.], ack 365705, win 0, options [nop,nop,TS val 2777960768 ecr 293554184], length 0
02:06:09.767267 IP 192.168.3.3.60950 > 120.77.37.121.8090: Flags [.], seq 365705:365706, ack 1, win 2052, options [nop,nop,TS val 293559682 ecr 2777960768], length 1
02:06:09.794386 IP 120.77.37.121.8090 > 192.168.3.3.60950: Flags [.], ack 365705, win 0, options [nop,nop,TS val 2777966273 ecr 293559682], length 0
02:06:15.269768 IP 192.168.3.3.60950 > 120.77.37.121.8090: Flags [.], seq 365705:365706, ack 1, win 2052, options [nop,nop,TS val 293565178 ecr 2777966273], length 1
02:06:15.291253 IP 120.77.37.121.8090 > 192.168.3.3.60950: Flags [.], ack 365705, win 0, options [nop,nop,TS val 2777971772 ecr 293565178], length 0
02:06:16.122531 IP 120.77.37.121.8090 > 192.168.3.3.60950: Flags [.], ack 365705, win 113, options [nop,nop,TS val 2777972543 ecr 293565178], length 0
02:06:16.122602 IP 192.168.3.3.60950 > 120.77.37.121.8090: Flags [.], seq 365705:367073, ack 1, win 2052, options [nop,nop,TS val 293566030 ecr 2777972543], length 1368
02:06:16.122612 IP 192.168.3.3.60950 > 120.77.37.121.8090: Flags [.], seq 367073:368441, ack 1, win 2052, options [nop,nop,TS val 293566030 ecr 2777972543], length 1368
02:06:16.122620 IP 192.168.3.3.60950 > 120.77.37.121.8090: Flags [.], seq 368441:369809, ack 1, win 2052, options [nop,nop,TS val 293566030 ecr 2777972543], length 1368
02:06:16.122627 IP 192.168.3.3.60950 > 120.77.37.121.8090: Flags [.], seq 369809:371177, ack 1, win 2052, options [nop,nop,TS val 293566030 ecr 2777972543], length 1368
02:06:16.122634 IP 192.168.3.3.60950 > 120.77.37.121.8090: Flags [.], seq 371177:372545, ack 1, win 2052, options [nop,nop,TS val 293566030 ecr 2777972543], length 1368
02:06:16.122641 IP 192.168.3.3.60950 > 120.77.37.121.8090: Flags [.], seq 372545:373913, ack 1, win 2052, options [nop,nop,TS val 293566030 ecr 2777972543], length 1368
02:06:16.122648 IP 192.168.3.3.60950 > 120.77.37.121.8090: Flags [.], seq 373913:375281, ack 1, win 2052, options [nop,nop,TS val 293566030 ecr 2777972543], length 1368
02:06:16.122655 IP 192.168.3.3.60950 > 120.77.37.121.8090: Flags [.], seq 375281:376649, ack 1, win 2052, options [nop,nop,TS val 293566030 ecr 2777972543], length 1368
02:06:16.122661 IP 192.168.3.3.60950 > 120.77.37.121.8090: Flags [.], seq 376649:378017, ack 1, win 2052, options [nop,nop,TS val 293566030 ecr 2777972543], length 1368
02:06:16.122685 IP 192.168.3.3.60950 > 120.77.37.121.8090: Flags [.], seq 378017:379385, ack 1, win 2052, options [nop,nop,TS val 293566030 ecr 2777972543], length 1368
02:06:16.146102 IP 120.77.37.121.8090 > 192.168.3.3.60950: Flags [.], ack 367073, win 103, options [nop,nop,TS val 2777972627 ecr 293566030], length 0
02:06:16.146107 IP 120.77.37.121.8090 > 192.168.3.3.60950: Flags [.], ack 367073, win 103, options [nop,nop,TS val 2777972627 ecr 293566030,nop,nop,sack 1 {368441:369809}], length 0
02:06:16.147609 IP 120.77.37.121.8090 > 192.168.3.3.60950: Flags [.], ack 367073, win 103, options [nop,nop,TS val 2777972629 ecr 293566030,nop,nop,sack 1 {368441:371177}], length 0
02:06:16.147613 IP 120.77.37.121.8090 > 192.168.3.3.60950: Flags [.], ack 367073, win 103, options [nop,nop,TS val 2777972629 ecr 293566030,nop,nop,sack 1 {368441:372545}], length 0
02:06:16.149176 IP 120.77.37.121.8090 > 192.168.3.3.60950: Flags [.], ack 367073, win 103, options [nop,nop,TS val 2777972630 ecr 293566030,nop,nop,sack 1 {368441:375281}], length 0
02:06:16.151220 IP 120.77.37.121.8090 > 192.168.3.3.60950: Flags [.], ack 376649, win 131, options [nop,nop,TS val 2777972632 ecr 293566030], length 0
02:06:16.151342 IP 192.168.3.3.60950 > 120.77.37.121.8090: Flags [.], seq 379385:380753, ack 1, win 2052, options [nop,nop,TS val 293566057 ecr 2777972632], length 1368
02:06:16.151380 IP 192.168.3.3.60950 > 120.77.37.121.8090: Flags [.], seq 380753:382121, ack 1, win 2052, options [nop,nop,TS val 293566057 ecr 2777972632], length 1368
02:06:16.151388 IP 192.168.3.3.60950 > 120.77.37.121.8090: Flags [.], seq 382121:383489, ack 1, win 2052, options [nop,nop,TS val 293566057 ecr 2777972632], length 1368
02:06:16.151394 IP 192.168.3.3.60950 > 120.77.37.121.8090: Flags [.], seq 383489:384857, ack 1, win 2052, options [nop,nop,TS val 293566057 ecr 2777972632], length 1368
02:06:16.151401 IP 192.168.3.3.60950 > 120.77.37.121.8090: Flags [.], seq 384857:386225, ack 1, win 2052, options [nop,nop,TS val 293566057 ecr 2777972632], length 1368
02:06:16.151409 IP 192.168.3.3.60950 > 120.77.37.121.8090: Flags [.], seq 386225:387593, ack 1, win 2052, options [nop,nop,TS val 293566057 ecr 2777972632], length 1368
02:06:16.151417 IP 192.168.3.3.60950 > 120.77.37.121.8090: Flags [.], seq 387593:388961, ack 1, win 2052, options [nop,nop,TS val 293566057 ecr 2777972632], length 1368
02:06:16.151428 IP 192.168.3.3.60950 > 120.77.37.121.8090: Flags [.], seq 388961:390329, ack 1, win 2052, options [nop,nop,TS val 293566057 ecr 2777972632], length 1368
02:06:16.151440 IP 192.168.3.3.60950 > 120.77.37.121.8090: Flags [.], seq 390329:391697, ack 1, win 2052, options [nop,nop,TS val 293566057 ecr 2777972632], length 1368
02:06:16.151449 IP 192.168.3.3.60950 > 120.77.37.121.8090: Flags [.], seq 391697:393065, ack 1, win 2052, options [nop,nop,TS val 293566057 ecr 2777972632], length 1368
02:06:16.186845 IP 120.77.37.121.8090 > 192.168.3.3.60950: Flags [.], ack 384857, win 67, options [nop,nop,TS val 2777972664 ecr 293566030], length 0
02:06:16.223370 IP 120.77.37.121.8090 > 192.168.3.3.60950: Flags [.], ack 393065, win 3, options [nop,nop,TS val 2777972705 ecr 293566057], length 0
02:06:21.726274 IP 192.168.3.3.60950 > 120.77.37.121.8090: Flags [.], seq 393065:393449, ack 1, win 2052, options [nop,nop,TS val 293571623 ecr 2777972705], length 384
02:06:21.751857 IP 120.77.37.121.8090 > 192.168.3.3.60950: Flags [.], ack 393449, win 0, options [nop,nop,TS val 2777978229 ecr 293571623], length 0
02:06:27.260046 IP 192.168.3.3.60950 > 120.77.37.121.8090: Flags [.], seq 393449:393450, ack 1, win 2052, options [nop,nop,TS val 293577147 ecr 2777978229], length 1
02:06:27.281964 IP 120.77.37.121.8090 > 192.168.3.3.60950: Flags [.], ack 393449, win 0, options [nop,nop,TS val 2777983763 ecr 293577147], length 0
02:06:29.130087 IP 120.77.37.121.8090 > 192.168.3.3.60950: Flags [.], ack 393449, win 117, options [nop,nop,TS val 2777985544 ecr 293577147], length 0
02:06:29.130141 IP 192.168.3.3.60950 > 120.77.37.121.8090: Flags [.], seq 393449:394817, ack 1, win 2052, options [nop,nop,TS val 293579016 ecr 2777985544], length 1368
02:06:29.130147 IP 192.168.3.3.60950 > 120.77.37.121.8090: Flags [.], seq 394817:396185, ack 1, win 2052, options [nop,nop,TS val 293579016 ecr 2777985544], length 1368
02:06:29.130152 IP 192.168.3.3.60950 > 120.77.37.121.8090: Flags [.], seq 396185:397553, ack 1, win 2052, options [nop,nop,TS val 293579016 ecr 2777985544], length 1368
02:06:29.130158 IP 192.168.3.3.60950 > 120.77.37.121.8090: Flags [.], seq 397553:398921, ack 1, win 2052, options [nop,nop,TS val 293579016 ecr 2777985544], length 1368
02:06:29.130164 IP 192.168.3.3.60950 > 120.77.37.121.8090: Flags [FP.], seq 398921:400001, ack 1, win 2052, options [nop,nop,TS val 293579016 ecr 2777985544], length 1080
02:06:29.153284 IP 120.77.37.121.8090 > 192.168.3.3.60950: Flags [.], ack 394817, win 107, options [nop,nop,TS val 2777985634 ecr 293579016], length 0
02:06:29.205997 IP 120.77.37.121.8090 > 192.168.3.3.60950: Flags [.], ack 400002, win 67, options [nop,nop,TS val 2777985683 ecr 293579016,nop,nop,sack 1 {398921:400002}], length 0

399 packets captured
1344 packets received by filter
0 packets dropped by kernel
